,komentarz,nie,tak,klasa
2241,Polecam jego Czerwony życiorys na wikipedii,1,0,0
2242,hahaha   co rosje obchodzi ze ukraina u siebie prąd wylaczyla,1,10,0
2243,Towarzysz Dębski nigdy się nie pogodzi z tym że komuniści w demokratyczny sposób stracili władze i przywileje. Panu Panie Dębski już dziękujemy.,10,7,0
2244,"Głosowałem na PiS, ale z tymi wynikami, to chyba przesada. Większość moich znajomych, którzy tez głosowali na PiS, teraz psioczy na zmiany, które się dzieją",15,5,0
2245,Petru sie juz wypowiedzial na ten temat?,1,0,0
2246,"Nie klam, bo sto dni jeszcze nie minęło.",1,0,0
2247,Boluś kompromitujące dokumenty zniszczył i udaje greka,84,49,0
2248,A ja proponuję Kurskipis Today. Dziewicza ale jakże wymowna.,1,0,0
2249,"Proste, PiS przejęło CBOS :)",4,2,0
2250,"POMYŁKA  OGLĄDAŁ  FILM  ,,  O  2  TAKICH  CO  UKRADLI.......",2,12,0
2251,"Dobrze się stało, że p. Lewicka zrezygnowała sama. Brak obiektywizmu, pewien defekt charakterologiczny polegający na tym, że w rozmowie z kimś najbardziej lubi sama odpowiadać na własne pytania, wzbudza uzasadnione wątpliwości co do jej przydatności w tej profesji.",1,0,0
2252,Może popełnił parę błędów tego nie wiem.   To co zrobił dla Polski i Europy jest bardzo wielkim osiągnięciem. Brakuje nam takich ludzi jak Wałęsa. Mam 72 lata i doskonale pamiętam te czasy. Ta nienawiść do niego wynika z niewiedzy i zazdrości.,8,5,0
2253,"Nie przyuważyłem, żeby PO miała jakąkolwiek trudność z odwołaniem Mariusza Kamińskiego za swojego panowania. Właściwie to został odwołany z naruszeniem zasad.",1,14,0
2254,BRAWO Narodzie ukochany! Będzie dobrze !,269,126,0
2255,"Poczekajmy do pierwszych mrozów to rządzącej Juncie kijowskiej zaraz pogorszy się humor jak Rosja zakręci kurak z gazem i ropą.Oni też powiedzą,że dokonali tego NIEZNANI SPRAWCY.",0,0,0
2256,i jak zwykle najbiedniejsi ludzie beda cierpiec ...zawsze w cywilow sie uderza,1,3,0
2257,dla mnie moze byc po 20 zł jestem na rencie Austryjackiej 2100 euro wielkie dzieki dla PIS,0,0,0
2258,PKB w Niemczech spada na łeb na szyję wcale JK się nie dziwię,4,8,0
2259,Racja,1,0,0
2260,"Czyż za te podsłuchy i ewidentne złamanie prawa nie powinni odpowiedzieć li tylko policjanci, ale przede wszystkim zleceniodawcy w osobach Tuska, Kopacz Sienkiewicza, Naczelnika i zastępcę BSW?",26,12,0
2261,Po inteligentych wypowiedziach lub blyskotliwych polizywaniach ludzie zakonczcie te dyskusje bo do niczego nie prowadziu,1,5,0
2262,nowy celebryta,0,1,0
2263,Ale rosja biednutka znow bedzie musiala bezahlen...Treść komentarza,11,7,0
2264,"5-6 MILIONÓW , A TO NIE CAŁY LUD. ZACHĘCAM DO WYBORÓW , BO POTEM BĘDZIE JESZCZE WIĘKSZY CYRK , NIŻ TERAZ",1,0,0
2265,"""Ostatnio Paweł Kukiz, w reakcji na kolejną, kuriozalną, atakującą i grożącą Polsce wypowiedź Martina Schulza, niemieckiego polityka, przewodniczącego Parlamentu Europejskiego, stwierdził: âWnuki faszystów nie będą mnie uczyły demokracjiâ. Jednak ta wypowiedź wydaje się zbyt łagodna (co jak na Kukiza dziwne). Stwierdzenie powinno być ostrzejsze: to Martin Schulz jest dzisiaj faszystą, który usiłuje nas uczyć demokracji""",1,0,0
2266,Niech sobie ten pomnik wezmą do siebie i po kłopocie  a propo to mam pytanko jak oni dbają o mogiły polaków poległych na ich ziemiach i o mogiły pomordowanych polaków które nie wiemy do tej pory gdzie są .,2,1,0
2267,A w czym Schulz czy inny dzisiejszy Niemiec jest winny tego co się stało w 39-45 ?,5,0,0
2268,"Pierwsze efekty szkoleniowe sil zbrojnych UK przez  CIA made in USA pokazuja swoje efekty ,z Syria nie wychodzi,ISIS ucieka a wiec od nowa na Ukrainie ,Polska czeka na interwencje, Macierewicz czeka na rozkaz z Pentagonu  na a tow.Kwasniewski na fotel ministerialny ten dyrektorski mu nie wystarcza",0,6,0
2269,ewentualnie swe własne memy :),3,2,0
2270,"Ale news! No po prostu dziennikarze Sejmowi na posterunku. Teraz prosimy o głosy ekspertów od marketingu politycznego z analizą jak ten śmiech niszczy demokrację.  Potem proszę o p. Petru, który zorganizuje w tej sprawie marsz protestacyjny. Potem prosimy o zaproszenia w mediach na ten marsz, transmisję na żywo z marszu i wywiady z uczestnikami. Potem memy z transparentami i wywiad na żywo  z organizatorami.  Potem może jakiś komentarz wydarzeń z prasy najlepiej niemieckiej i interpelację z trybuny sejmowej. Nie nudzi się wam?",43,26,0
2271,... JUŻ MĄCI.,12,17,0
2272,Pan Kaczyński też jest człowiekiem. Mi się podoba tak spontaniczne zachowanie. Popieram.,11,9,0
2273,"Podsluchy byly juz wczesniej a PO z nich tylko skorzystala, jak juz byly :-))) Co sie mialy zmarnowac ... :-)",459,163,0
2274,"Amerykanie mają , ale po co ujawniać skoro w ten sposób mają prezesa w ręku",2,1,0
2275,Prezydent zawsze dotrzymuje słowa  panie i panowie z WP,9,2,0
2276,"Mam rozwiazanie dla wałesy:
kamera
IPN 
biskup 
zwrot papierów 
i SZCZERE WYZNANIE WIN
kazdy kto raz był na SB mu WYBACZY",87,58,0
2277,Jakie nieszczęście byłby SPOKUJ,1,4,0
2278,"W trakcie oglądania przez P. Prezesa Kaczyńskiego odbywało się głosowanie: jak ogłosił marszałek sejmu : głosowało 449 posłów, za 216, przeciw 233, nikt się nie wstrzymał. Jak głosował P. Kaczyński, skoro czymś innym był w pełni zajmował się.",2,8,0
2279,"No, straszne. Ale przecież Krym nie potrzebuje Ukrainy, bo jest od zawsze rosyjski , hi,hi,hi ;).",4,2,0
2280,Jesteśmy   bardzo  zadowoleni .,0,0,0
2281,"Dlaczego ta pani ""dziennikarka"" udziela wywiadu dla niemieckiej gazety?",2,1,0
2282,"Brawo  PIS I  NOWY   RZAD.oSTRO PRACUJA.MImo utyruaniania   przez   opoizycje  ocierajaca sie   o   Targowice.Starey  układ  ma  pieniądze  , kontakty   środki   banki i media  i nie liczy się  dla  niego  dobro POLSKI,nie  wahają  się  na  szukanie  wsparcia   za  granica    która  widzi   w nich  gwarant,  85 %    prasy mas  mediów.,To  walka  ze  współczesna    Targowica",3,1,0
2283,Kaczyński z Ziobrą???,4,0,0
2284,I dalej nie wiesz o co chodzi,1,0,0
2285,"Oglądał nowe memy, może na portalu Demotywatory. Niektóre są bombowo śmieszne!",1,0,0
2286,"Znaczy się układ z Magdalenki zaczyna się walić ,idzie nowe.",3,2,0
2287,Dzięki no to jedziemy na 5 zł  exporterzy zarobią będzie praca wiecej miejsc pracy wiecej firm będzie a i Szczawiu niebada zwozic rolnicy Polscy zarobią jedziemy na 5 zł ze euro,0,0,0
2288,"Dlaczego Kreml jest taki pazerny, mając 22 mln km ziemi leżącej odłogiem, niezagospodarowanej sięgać po cudzą własność, Pólwysep Krymski.",3,0,0
2289,Pewnie śmieje sie z Niemców đ,2,9,0
2290,tusk kary nie uniknie pszyjdzie czas na niego nie bawem.,1,0,0
2291,same chmskie wpisy  wp. nic sobą nie reprezentuje,8,2,0
2292,jajc/enuk i czekoladowy samozwaniec zrobili dobro robote,1,2,0
2293,W latach 80-tych wielu było z nim. Potem powoli odkrywał swoje drugie oblicze i wielu go znienawidziło za oszustwo i ignorancję robotników,4,1,0
2294,facet ma poczucie humoru,7,23,0
2295,"Lubię ludzi, którzy umieją się śmiać.",3,13,0
2296,"Masakra!
Nie śmieje się - źle! Śmieje się jeszcze gorzej. Ludzie dajcie spokój z tymi oszczerstwami! Zajmijcie swoim życiem!",2,0,0
2297,"Proponuję, skrócony okres wypowiedzenia i 70% podatku z odprawy.",1,0,0
2298,No w zasadzie racja. Może za wyjątkiem sytuacji gdy cala sprawa od początku jest zwykłą ustawką a tu PiS ma niemałą juz wprawę.,4,2,0
2299,Proszę nie wpuszczajcie imigrantów.,1,7,0
2300,gdzie to poparcie  rośnie? chyba w sejmie bo na pewno nie u wyborców,13,7,0
2301,Czy jako wyborca PIS mogę odliczyć sobie VAT od prezerwatyw?,10,4,0
2302,"skoro""sztuka nie powinna mieć granic"" - cytat pani reżyser tego pseudo-spektaklu - to może wkrótce przedstawi pani na scenie zabijanie człowieka i uzasadni to pani, że to sztuka i nie powinna mieć granic. 
Czy nie dostrzega pani absurdalności tego stwierdzenia? Hitler też uważał, że nikt nie może mu stawiać granic, bo to tylko polityka",5,2,0
2303,"Niech się przekwalifikuje, dziś i wczoraj mówili to górnikom, stoczniowcom itd.",554,414,0
2304,napewno rozbawiło wielkoego Jarka że jeszcze ktoś mysli że w polsce jest demokracja,1,1,0
2305,"Na razie zwalnianie idzie im dobrze. Tyle, że w takim tempie, to któregoś pięknego dnia telewizję śniadaniową poprowadzi człowiek w mundurze pułkownika bo nie będzie już innych chętnych ;-p",3,2,0
2306,Okazuje się że Jarosław Kaczyński to nie maszyna tylko człowiek. To ważna wiadomość.,1,1,0
2307,"po 30 latach w jednej firmie (abstrakcja w gospodarce wolnorynkowej) odchodzi dziennikarka więc piszą o tym gazety, portale, mówi się o tym w radiu i telewizji...
ale ta Pani z głodu nie zginie bo albo emerytura 9raczej nie 900zł) albo równie lukratywna praca w bliższej jej poglądom politycznym konkurencyjnej stacji/wydawnictwie...
a jak zamykamy kopalnię i zwalniamy kilka tysięcy górników to te same ""wiarygodne i obiektywne"" środki masowego przekazu komunikują, że to restrukturyzacja zacofanego kraju...
coś w tym jest - jak się komuś chce i ma czas to wszędzie znajdzie ziarnko prawdy, tylko sklala problemu nie co inna ;-)
pozdrawiam tych co nie znikną po haśle ""jestem więc myślę"" :D",21,7,0
2308,I znów stara komuna na ulicach to chyba jedyny taki moment w ich historii gdzie mogą iść i protestować dlatego że przedtem to przeciw nim protestowano .,1,0,0
2309,Ja go nawet ostatnio trochę polubiłam.,1,1,0
2310,"Właśnie i marnie skończyło , a Pis skończy najpierw  ze swoimi fanatykami ,bo reszta wyjedzie .",6,2,0
2311,"Gdy Warszawa po wojnie była zaminowana to trzeba najpierw było ją rozminować i odgruzować aby można na nowo ją odbudować.W podobnej sytuacji jest PiS najpierw chce naprawić to co zepsuta PO a potem realizować to co zamierza zrobić ma na to osiem lat rządów,wtedy można porównać PO do PiS",4,0,0
2312,co prawda to prawda z demokracje bywało gorzej wystarczy przypomnieć fakt z napadem na dziennikarzy WPROST i afera podsłuchową,898,599,0
2313,"Pan Jarosław się postarzał, źle wygląda, myślę że to mogą być jego ostatnie 4 lata przed emeryturą (kogo będzie wtedy atakować opozycja, będą musieli w końcu napisać swój program :0).",1,0,0
2314,Zapytajcie Petru ... on wie wszystko.,4,1,0
2315,"czy pan dziennikarz Jeneralski, w tvp za czasów lewaków i tw, to mąż pani dziennikarki ze znakomitego grona?",1,0,0
2316,"Nasz nowy prezydent jest bardzo sexy, czasami fantazjuje na jego temat.. :-) a co, nie wolno? szkoda że jest zajęty heh",6,1,0
2317,"Kupuje bloki na kredyt  i już podnieśli mi ratę,  wliczyli podatek PiSu,  nie długo podniosą ceny w sklepach, kto zapłaci za obietnice PiSu?  Polacy co tak bardzo ich kochają,  :( i my wszyscy.",1,0,0
2318,"nie martwcę się , już naprawili...",0,0,0
2319,CzekM na 5 zł  i sprzedaje euro,0,0,0
2320,"Jaro jest prawilny, pierwszego nie popija i na policje nie chodzi.",1,0,0
2321,Dobrze widzieć śmiejącego się czlowieka:-D,3,3,0
2322,aczy Pis nie czynił tego samego gdy ich przeciwnicy rządzili?,4,3,0
2323,"Panie Wałęsa ,niech pan się już bardziej nie kompromituje !!",2321,1654,0
2324,"Ja bym to ujął tak: Po złożeniu dymisji przez szefów służb: (...) komisja sejmowa w trybie pilnym na wieczornym posiedzeniu, powołała na wakujące stanowiska następujące osoby: (...)",2,4,0
2325,Brawo za własne zdanie. I tyle. Pozdrawiam,4,1,0
2326,"BRAWO PANIE ANTONI!!! WSZYSTKICH WINNYCH TEJ TRAGEDII NALEŻY OSĄDZIĆ I OSADZIĆ NA DŁUUUUGIE LATA W PUDLE!!! Głosowałem na Pana i oczekuję, że tak się stanie.",2,0,0
2327,"Brawo Pani Karolino, ma Pani w całej rozciągłości rację. Najbardziej będą cierpieli Ci dziennikarze którym będzie się wydawało że się ""wślizgneli"" w nowy układ. A Prezes jest pamiętliwy.",2,1,0
2328,"Bardzo mily,wrazliwy, inteligentny i  madry polityk",12,5,0
2329,Panie Schulz nie Pan spojrzy na niemieckie media!,53,25,0
2330,"I słusznie złożyła dymisję - odrobina honoru nikomu jeszcze nie zaszkodziła, a wyrzut sumienia gryzie i boli. Proszę zauważyć, że red. dr Marcin Ziemiec nie musi składać dymisji i NA PEWNO zostanie w telewizji, bo niezależnie od okoliczności zawsze MIAŁ KLASĘ! Co to znaczy? Nigdy nie napadał na zaproszonych przez siebie gości, a i tak uzyskiwał konkretne odpowiedzi, nie przerywał wypowiedzi, nie narzucał swego zdania! Proszę go posłuchać w porannych wywiadach, jakie prowadzi także w RMF FM. Wszędzie go chcą.",2,1,0
2331,Po co i komu potrzebne sa te sadaze?!Chyba po to by wkurzac ludzi?!,4,0,0
2332,"Większość zwalnianych pracowała w TVP znacznie dłużej, niż tylko ostatnie 8 lat rządów PO-PSL, np. Pani Godlewska -Jeneralska 30 lat, a Kraśko 25 lat i jakoś nikt ich nie zwalniał pod pozorem ""dyspozycyjności"". Mało tego, tenże Kraśko szefem Wiadomości został za czasów poprzednich rządów PiS, kiedy naczelnym szefem TVP był znany ówcześnie pisowski polityk - niejaki Urbański, swego czasu prawa ręka ś.p. Lecha Kaczyńskiego. Widocznie wtedy Kraśko nie był jeszcze Żydem i ubekiem.",2,1,0
2333,"o ile pamiętam, ruscy wysadzili ropociąg do rafinerii w Możejkach zaraz po zakupieniu tego obiektu przez Polaków...",3,2,0
2334,Nas uczciwych POLAKÓW to nie interesuje,1,2,0
2335,Szacunek .,3,1,0
2336,"Otóż nie. Kaczyński się śmiał z twittowej odpowiedzi Kukiza do Lisa: ""(...) Gucwiński ma prawa do 'Z kamerą wśród zwierząt' "".",2,4,0
2337,"Szkoda, bo i ładna i ładny głos miała. Dobrze ze chociaz w Tok-u go sobie nadal posłucham :)",4,2,0
2338,"Wiekszosc Polakow popiera rzad PIS. Polacy czuja sie dumni z nowego rzadu !
Teraz Polska",5,4,0
2339,"To ich przekonaj aby nie głosowali za niezależnym Krymem, a nie siedź w Polsce w ciepełku i o  pełnym brzuszku i nie podpuszczaj polaków, bo nie maja w tym żadnego interesu..",0,3,0
2340,właściwie to czemu nazywają ich służbami?,0,0,0
2341,"imigranci w Kolonii zaatakowali nie tylko kobiety. Od 19tej atakowali Katedrę-symbol chrześcijaństwa w Europie, wpisaną na listę unesco. W tamtym czasie odbywała się msza w katedrze. Muzułmanie obrzucali ją petardami. To była atak na chrześcijańskie wartości, dorobek unii i zachodu. To nie były zwykłe gwałty i obmacywanki, nie dajcie się zwieść. ""Imigranci ""muzułmańscy  dali wyraz temu, po co tutaj naprawdę przybyli.",5,849,0
2342,"Nie słuchają TK, źle. Wykonują jego wyroki, źle",1,0,0
2343,"Bo w Polsce nie było komuny, tylko socjalizm",1,0,0
2344,"Niemcy boją się islamistów, jak Anglicy Hindusów.",0,0,0
2345,Putler,9,11,0
2346,Spokojnie bedą rozmawiać o biesiadach u Sowy!,11,2,0
2347,BRAWO Piotr Kraśko!!!,4,0,0
2348,"Dębski i Żakowski należą do tego samego typu dziennikarzy którym się nic nie podoba i wszystko wiedzą najlepiej. Zagorzali przeciwnicy powinni oprócz ustawicznego biadolenia i katastroficznej pisaniny zaproponować  czy też przedstawić swoim fanom jak oni poprawiliby byt Polaków i sprawili,że Polska stałaby się mlekiem i miodem płynąca, że nareszcie mielibyśmy wymarzony przez utopistów kraj wiecznej szczęśliwości. Zasada jest jednakże prosta - mniej pisania i prowadzącego donikąd krytycyzmu a więcej czynów poprawiających, zdaniem takich właśnie dziennikarzy, ponoć nieudolne rządy PiS. Może tego rodzaju pismaki powinni powołać się na wcześniejsze rządy i wymienić ich dorobek i wykazać, że potrafili w ciągu kilku miesięcy dokonać przełomowych zmian w większej skali niż PiS teraz.",254,173,0
2349,"Alez to oczywiste ze pan Martin Schulz podziwia polski narod. Daje temu dowody na kazdym kroku mowiac mowiac m.in., ze demokratycznie wybrane polskie wladze dokonuja ""zamachu stanu"" oraz porownujac Polske do Rosji Putina. Obecna rozmowa z nasza Premier przebiegala zapewnie w rownie dobrej atmosferze jak poprzednia po jego wypowiedzi o ""zamachu stanu"" w Polsce. I po poprzedniej rozmowie Schultz wystapil z teza o ""putinizjacji"" polskiej polityki. Ciekawe jaka obrazliwa teze wystosuje po obecnym spotkaniu.",417,209,0
2350,JA TAKŻE CHETNIE POZNAM,0,6,0
2351,zmiany w ordynacji wyborczej.....,5,4,0
2352,"Moher Power Unia ma prawo zablokować dopłaty dla rolników jak i dotacje do inwestycji . "" Polska dostaje z Unii trzy razy tyle co wpłaca "" dane dostępne w internecie .",11,3,0
2353,"Pani Lewicka ciągle nic nie rozumie, i nie przyjmuje do wiadomości bo taki jest jej profesjonalizm.Kiedy do tego dochodzi jeszcze zbyt wybujałe ego, to wszystko jest zrozumiałe. Chciałabym aby dotarło do niej i innych tak zwanych niezależnych dziennikarzy, że mi jako odbiorcy zależy na rzetelnej informacji a jeśli już jest do niej załączony komentarz to powinien on być bezstronny.Dziennikarz jest gospodarzem programu i nie ma prawa obrażać swoich gości ani przedstawiać swoich poglądów politycznych.Media mają być bezstronne.Tak niestety nie było. To tacy dziennikarze jak pani Lewicka przyczynili się do tego , że ludzie poszli głosować na PIS.
Ps.Nie jestem z małego miasta, ani z Radia Maryja(jestem osobą niewierzącą), mam wyższe wykształcenie i nie będę już głosować na nikogo.",1,0,0
2354,"gdybym przeczytał, że: Rosja zadowolona z..., Rosyjski MSZ jest wdzięczny za... - to bym się zaczął niepokoić!",2,0,0
2355,tak znajdziemy sprawców jak oni oddaj wrak samolotu. proste,4,3,0
2356,SMIECH TO  ZDROWIE NALEZY SIE SMIAC. BARDZO DOBRZE PANIE KACZYNSKI.,1,0,0
2357,precz z terrorystyczna rosja ktora okupuje krym i donbas mordujac tak tysiace obywateli i to jest terroryzm a nie ten w paryzu.,4,2,0
2358,"Sprzeniewierzyl sie wszystkim wartoscia o ktore podobno walczyl. Ciekaw jestem czy pamieta przynajmiej piec z dwudziestu jeden  podstawowych postulatow.Zbliza sie niestety koniec , i w oczy zaglada strach przed tym co bedzie po drugiej stronie. Ludzie uczciwie postepujacy za zycia, nie boja sie tego co ich czeka po smierci.Stad chyba ta chec oczyszczenia sie.",150,128,0
2359,To nornmalne to był polak,3,0,0
2360,Drodzy rozmowcy nie uzywajcie juz slowa PO bo to skandal na miera swjatawa nalezy sie tym ludziom dokladnie prztyjzec rostrwonili Polska gospodarke a teraz sie nasza jak to szczega demokracji ze w polsce jest zagrozona to paranoja wszyscy z PO boja sie skandalu na miare swjatowa oni sie nie licz i jch slowa,2,0,0
2361,Bez żalu.,4,3,0
2362,"Zobaczył, ile wzrosną Polakom rety kredytu w wyniku ich rządów i obniżenia ratingu. Podobno w poniedziałek uchwałą sejmu agencje ratingowe zostaną zlikwidowane.",2,3,0
2363,jaki on kochany,7,1,0
2364,"panie  prezesie czy nie moze pan tak czesciej sie smiac,jest pan wtedy sympatyczny,naprawde zupelnie inny czlowiek!",2,1,0
2365,co by nie mowić jest prawdziwy.:),1,3,0
2366,"Normalny człowiek od czasu do czasu się śmieje. A propos, czy ktoś widział śmiejącego się Petru bo ja nie tam tylko ciągła do czegoś pretensja",3,1,0
2367,"Tego nikt nie wie nawet   chyba""J. K "" sam",2,1,0
2368,"SAMA SIE USMIECHAM JAK WIDZĘ PANA PREZESA UŚMIECHNIETEGO!...DOBRY CZŁOWIEK! OBY JAK NAJWIĘCEJ PANIE JARKU BUŻKI UŚMIECHNĘTEJ, JESTEM Z PANEM!",0,0,0
2369,"Pani Karolino !  Jest Pani PROFESJONALISTKĄ , tak powinien pracować dziennikarz.
Byłam pewna, że zniszczy Panią PIS -owski Rząd.  Zyczę Pani zdrowia , optymizmu !
""KIJ MA DWA KOŃCE "", myślę ,że wkrótce Rząd sie zmieni bo tak być nie może !",6,3,0
2370,30 lat w jednej firmie. To się prawie nie zdarza. Widać jak się za PRLu dostała to ktoś ją tam nieźle ukrywał i wynagradzał.,1,0,0
2371,"W średniowieczu my jechaliśmy z wyprawami krzyżowymi, obecnie oni przyjechali do nas z wyprawami allahowymi",0,4,0
2372,"cieszy się , że dostał na tablet info. o obniżeniu wiarygodności finansowej naszego kraju z A+ na BBB+ , jeszcze trochę i będziemy podobnie jk Grecy mieć wysoki ranking .",5,6,0
2373,Już wystarczy tego filmu.Jest beznadziejny.,22,18,0
2374,"Spokojnie...... na razie bierze PiS, kiedyś wezmą PiS.  Buehahahaha....",2,2,0
2375,Jeden zadowolony jest . Szkoda że nie wszystkim tak wesoło,7,9,0
2376,"Nie musieli by wychodzić gdyby uchwalili w czerwcu, że wygrali wybory!!! Równie dobrze mogli uchwalić, że Andrzej Duda nie może zostać prezydentem w sierpniu a jedynie w styczniu!!!",2,1,0
2377,To Ukraińcy chcą na nowo rozpętać wojnę.,35,171,0
2378,"Brawo! - Polskę trzeba naprawiać, a nie konserwować układy wywodzące się jeszcze z PRL-u.",55,21,0
2379,"Mieciu wyniósł akta ""Bolka"", które już nie wróciły do IPN-u.
W związku z tym NIC NIE UDOWODNICIE !!!",66,27,0
2380,kto bedzie wygadywac na Walese  tego BOg pokarze,5,0,0
2381,"Nie wiedziałam, że pan Jarosław potrafi się śmiać.",1,0,0
2382,Gdy ja wychodzę z pracy to mi nie płacą...,2,1,0
2383,Niemcy aby najechać na Polskę w 1939 sprowokowali akcję na radiostację w Gliwicach... Putin kupił Europę zachodnią akcją w Syrii więc teraz czas na plan B na Ukrainie gdzie sytuacja  w zbuntowanych republikach zaczęła się sypać... W obronie interesów obywateli Rosji trzy zbuntowane (na razie) republiki niebawem będą należeć do Rosji...,2,0,0
2384,"On wie. On wie. Tego smiechu nie lubi 50% ludzi z KOD a niedawno wyborcy PIS plus SLD,PO,Nowoczesna. 25% Kukiz 15% i duzo niezrzeszonych",3,0,0
2385,Najwyższy czas wyjść do ludu na praktykę.Po praktyce starać się o prace,1,0,0
2386,"Już dawno  czyli zaraz po ogłoszeniu wyników postulowałem  aby  PiS obradowało i uchwalało ustawy w poniedziałek , środe i piątek  a opozycja powinna miec obrady we wtorek , czwartek i sobote",2,0,0
2387,Stary człowiek i SB,41,19,0
2388,W sumie to naprawdę śmieszne.,0,0,0
2389,"Zobaczył najnowszy sondaż: liderem partia R. Petru NOWOCZESNA.PO, na którą chce głosować 149 % Polaków, a sam Rysio cieszy się 204 % poparcia społecznego.",32,102,0
2390,PiS Wybralo tylko 20 % narodu.  A chcą  decydować za całość. Trzeba ich pilnować,8,0,0
2391,"Prawdziwy czy nie, ten teks jest zarąbistyđ",0,0,0
2392,"Przeczytał,że Jaruzelski był z Rajmundem w opozycji:-)",3,5,0
2393,to samo można powiedzieć o politykach jak daleko są zdolni się posunąć też w tym chodzi o kasę i popularność czy rzecznik praw możne im tego typu działalność zabronić,2,0,0
2394,brawo pis! jesteśmy dumni ze mamy w końcu polskie rząd!!,9,6,0
2395,Dobry kierunek. Ma taki kanał anglojezyczny telewizji satelitarnej np. Ukraina i Rosja.,6,2,0
2396,Tak samo uwazam. Jestem ZA p.Walesa. Duzo zdrowka p.Prezydencie!!!,1,0,0
2397,Brawo pani Dominiko !!! Trzeba mieć klasę a pani ją ma.,4,3,0
2398,"A co za różnica, grunt, że zrobił co trzeba.",3,1,0
2399,"Niedługo wyjdą ciekawe materiały o piśie,to dopiero będzie sensacja",5,0,0
2400,"to że zawirowania na walutach nastąpiły wczoraj nie jest zasługą pisu ani jakiejś agencyjki w piątek 15.01.2016 zaczął się KRACH w poniedziałek na świecie wybuchnie kryzys  jakiego nie widzieliśmy od niemal wieku. Poczytajcie poszukajcie nie czytajcie ""polskich"" portali bo one tego nie napiszą. I szkoda waszego czasu",2,0,0
2401,WAŁĘSA GDZIE MOJE STO MILIONÓW?????,63,38,0
2402,No to gratuluje panu Kaczyńskiemu poczucia humoru jak pójdzie na piwo to więcej takich usłyszy,1,0,0
2403,"tak, w mojej firmie jak ktoś się np. nigdy nawet nie uśmiechnie to z nim nikt pracować nie chce .. SKK ty to pewnie bezrobotny, co nie ?",1,0,0
2404,"Mam prośbę,aby postanowiono że w czasie obrad zabronione jest używanie telefonów komórkowych i tabletów.Przecież oni są w pracy ,nam w pracy nie wolno używać telefonów i rozmawiać/prywatnych/",3,6,0
2405,Szczęśliwy Kaczyński to szczęśliwa Polska,2,2,0
2406,może zobaczył jak będzie wyglądała Polska za jakiś czas po wprowadzeniu wszystkich ustaw pis-u...,367,473,0
2407,"I słusznie. Kontrola nad służbami musi być. PO przez 8 lat skupiało się na tym, aby służby pozwalały platformersom i peselowcom szabrować Państwo ile się da. I co z tego wynikło - widzieliśmy.",1,14,0
2408,Panie prezesie tak trzymać.Jeszcze czekamy na podatek od marketów!,38,33,0
2409,Też tak to widzę.,4,1,0
2410,"Zawsze i wszędzie jak zmienia sie władza, zmieniają sie kadry. Co w tym dziwnego. Czy poprzednicy tego nie robili???? Poza tym, tyle ludzi traci prace i nikt nie robi z tego atrakcji a tu prosze, utratnych posadek i szuuuuum!!!",3,2,0
2411,Podziwiam Panią.,7,6,0
2412,"Panie Duda. Okres składkowy 40 lat spowoduje, że wielu pracowników, szczególnie tych młodych, nigdy nie doczeka emerytury, a tzw rolnicy na KRUS-ie pójdą na emeryturę w wieku 56-58 lat. Nie na taką ustawę czekamy!",3,2,0
2413,"A czym było uchwalenie na kolanie rzutem na taśmę ustawy, która skracała kadencję kilu sędzim TK tylko po to, by nowych zdążył wybrać jeszcze stary sejm, w którym większość miały PO i PSL jak nie zamachem na Trybunał Konstytucyjny? To wtedy złamano prawo i to dziś próbuje odwrócić PiS. Proste jak budowa cepa. PO od kiedy przyjęła wreszcie do wiadomości, że jednak ma z kim przegrać i że porażka jest nieunikniona zaczęła się okopywać na wszystkich możliwych frontach przyjmując pośpiesznie różne ustawy, które miały jej członkom zagwarantować bezkarność, synekury na najbliższe lata, możliwość sabotowania poczynań nowej władzy jak tylko to możliwe. PiS jeśli poważnie myśli o rządzeniu Polską a nie o zawiadywaniu nią musi wiele rzeczy poodwracać. Nie wszystko zdaje się można niestety ale tam, gdzie to możliwe nie ma wyjścia. Ale bawi mnie jak politycy PO krzyczą o zamachu na TK czyli zamachowcy wrzeszczą, że ktoś inny zamachu dokonuje. Ano złodziej krzyczy łapać złodzieja...",103,63,0
