,komentarz,nie,tak,klasa
3150,"No własnie, dziwne. Tatarzy sa zbyt mądrzy, zeby teraz organizowac jakieś zamachy. Przecież nigdy tego  nie robili. Ktoś chce zrzucić na nich winę. Kto? Komu zależy na destabilizacji Ukrainy?",3,9,0
3151,"Zacofany Maleńczuk ze swoimi kijami bejsbolowymi. ""Wprowadza w błąd, co w przyszłości może nas kosztować osłabienie wiarygodności Polski""",1,0,0
3152,"Prawda ostatniego zdania odnosi się do Narodu, a nie tylko do części rządu.",32,20,0
3153,W FERWORZE WALKI ZAPOMNIELI ZGARNAC PUTINA .,0,2,0
3154,"Jedyne źródło wiadomości, z który można coś wartościowego uzyskać  to komentarze. Lepsze czy gorsze ale przynajmniej zmuszają do myślenia. Jeśli polska przyjmie uchodźców to będzie pierwsza duża wpadka nowego rządu. 90% polskiego społeczeństwa nie chce uchodźców. Chociaż powiem szczerze, że nie znam nikogo kto by ich przywitał z otwartymi ramionami. Miejmy nadzieje, że nasza władza pomimo POwskich zobowiązań nie przyjmie nikogo. Niech prezydent Duda wykaże się społeczną odwagą i otwarcie powie co myślą Polacy.",1,13,0
3155,Podejrzewam że to separatyści donieccy chcą aby ukraina nie zarabiała na pracy dla ludzi.Chcą za wszelką cenę zdestabilizować pokój na UKRAINIE. To są dopiero terroryści!,6,3,0
3156,"On pisze,że używana a na prawdziwej polskiej wsi to towar poza gatunkiem.",1,0,0
3157,"do wszystkich nas bez problemu dociera, że hitlerowcy ukrywali dobra na Dolnym Śląsku z nadzieją, że tam jeszcze wrócą. Dlaczego więc nie dociera do nas, że UBecja w ostatnim okresie fabrykowała dowody w nadziei, że powróci do władzy?",4,2,0
3158,"To pewnie sondaż na zamówienie PiS. Ja im mogę zrobić taki sondaż, ze będą mieli wyższe poparcie niż Putin w Rosji. Ale muszą dużo zapłacić.",5,2,0
3159,"Byłem na Krymie latem ( chociaż to niby teraz nielegalne, ha,ha ) moim zdaniem Tatarzy pożałują tych akcji; sami sobie ""zapracowują"" żeby ich gnębić ; tam nikt ich nie prześladuje ; Ruscy po prostu ""wyławiają "" tych co pracują dla Amerykanów ; ale co mają robić ; pozwolić sobie na wywołanie ""tatarskiej rewolucji"" na Krymie ; niedoczekanie Europy, USA czy Polski ; a tamci ludzie tworząc ""piątą kolumnę "" poświęcają się w imię zachodnich interesów które są jeszcze bardziej obrzydliwe jak ruskie ( Irak, Syria,Libia, Afganistan ...) szkoda mi Tatarów , ich wódz podpuszczany przez USA i Europę a wygnany przez Rosjan stoi za tym wszystkim ;",40,110,0
3160,to kĂ¸aMSTWO petru ma 169% i już!!!,137,90,0
3161,"Zaden z moich komentarzy, nawet te umijarkowane, nie pojawily sie od 4 circa dni? PIS juz cie przejal, WP???",8,1,0
3162,"Wreszcie zaczęto pisać prawdę o PO...Brawo Panie Michale.PO doprowadziła do ruiny kraju w każdej dziedzinie....gospodarka,sądownictwo,bezrobocie,wyprzedaż majątku.Kiedy wreszcie PiS zacznie karać winnych????Nie mogę doczekać się tej chwili chociaż wiem że to jeszcze potrwa.",27,13,0
3163,"Pewnie rozbawily go slowa ,,oredzia do narodu'' Ryszarda Petru: zglaszam sie do panstwa jako lider sejmowej opozycji ;)",3,2,0
3164,jak to co ? pierwszy przelew....,4,6,0
3165,obejrzał w końcu przemówienie Glińskiego na tablecie,1,1,0
3166,Aby odwołać Wojtunika należy zrobić to samo co Tusk: po prostu Premier Beata Szydło powinna go odwołać i tyle w temacie! Tusk nawet nie czekał na opinię Prezydenta Lecha Kaczyńskiego tylko po prostu go odwołał. Po za tym Wojtunik jest nagrany przez kelnerów i to już moim zdaniem dyskwalifikuje gościa z tak ważnego stanowiska.,1,13,0
3167,"Lepper jeżeli miał jakieś dokumenty na PO, to by je natychmiast opublikował. Mógł je mieć tylko na pis i chciał coś ugrać i dlatego go uśmiercono. W Polsce według niezależnych źródeł światowych korupcja za PO-PSL wyraźnie zmalała i nie ma co zaklinać rzeczywistości. Najgorsze rządy i stracony czas były w latach 2005-2007 a następne są dopiero przed nami.",25,3,0
3168,Chcieli do Rosji to niech wielki brat im dostarczy !!!,0,0,0
3169,i  to ma sie nazywac praca i walka o lepsza  polske??,1,9,0
3170,"Jeżeli interwencja lądowa nie jest możliwa,  to powinni tam zrzucić jedną bombę atomową, to może trochę by się uspokoili. Rosja Wszystkich straszy swoim atomowym arsenałem, a tu nie może go użyć?? Jeżeli od tego zależy los nas wszystkich, to albo my albo oni.",3,18,0
3171,"Trochę to absurdlane twierdzenia, w szczególności w stosunku do Assada, bo o jakim reżimie może być mowa kiedy ISIS zagarnie mu 70% czy 90% terytorium. Sukcesy ISIS to klęska Assada. Facet będzie się utrzymywał na powierzchni tak długo jak będzie w stanie walczyć z ISIS. Inaczej stanie się bezwartościowy dla Rosji.",0,0,0
3172,"Po co o tym pisać? A to tylko w TVP ludzie są zwalniani po 10-20 czy 30 latach pracy? Tysiące Polaków również potraciło pracę po iluś latach pracy, poszli wtedy do innej i żyją dalej. Nie widzę powodu, by pracownicy telewizji MUSIELI pracować dożywotnio w tej czy innej stacji..",21,10,0
3173,"kiedy likwidacja um.zlecenie ,agencji pracy tymczasowej tzn do smierci ,HR-wspolczesnej formy segregacji niewolnikow,odsuniecia od pracy emerytow resortowych ,przeswietlenie pefronu itp cyrkow",2,1,0
3174,"Fajna, a kasa się jej należy.",11,8,0
3175,Bzdura. Sami podali sie do dymisji,2,15,0
3176,Zgadzam się w stu procentach! Nie chce za kilkanaście lat żyć w kraju gdzie moja wolność będzie ograniczana przez Islam. Nasz kraj jest zbyt piękny żeby to zaprzepaścić .,0,0,0
3177,Np jaki film. Listy do M. ? Poza tym to ludzie chcieli żeby ten film był w ramówce na Święta.,3,2,0
3178,sliczna ładna niech ma nie bede jej załowac poprostu boska tak trzymaj ewelinko pa pa,7,5,0
3179,"O przelicznik złotego jestem spokojny. Przecież im słabszy złoty, tym lepszy eksport, twierdzą ekonomiści platformerskiego Lewiatana. Co do sułtana , ten tekst jest niezły i przydałby się dziś niektórym eurosułtanom.",0,1,0
3180,"Wystarczy , ze będą u siebie - daleko od nas .",0,3,0
3181,"Foto AFP/ Filippo Monteforte"" Papież Franciszek"". Widzi dalej, niż sądzimy.   Stwierdzenie o potrzebie pomocy muzułmanom w potrzebie.  Ufam Juanowi Maria Bergoglio. ""Muzułmanie i chrześcijanie są braćmi ""-trudna jest ta mowa. Na razie przesłanie to widzi i rozumie Kanclerz Niemiec i Papież.",3,0,0
3182,"Zgadzam się, i Alaskę Rosji oraz Wilno i Lwów Polsce. Weź sie za leczenie albo zwróć się do ""zielonych ludzików"" oni nie zabijają tylko lecza z megalomanii.",1,5,0
3183,"@~Ryzyk41fizyk : nie wiem, czy ""Służby to największa stajnia augiasza III RP""... Wiem natomiast, że te służby to łakomy kąsek dla władzy, która widzi w tych strukturach fundament dla sprawowania swej władzy i jej omnipotencji. To dlatego  - m.inn., nie doszło do koalicji PiS-PO w 2005 roku, bo niedoszli koalicjanci nie chcieli sobie wzajem odpuścić zawłaszczenia tych służb. Tym razem PiS ma sejmową większość, więc już bez żadnych oporów ""...biorą służby nocą"".",11,4,0
3184,co jak co ale usmiechniety i rozbawiony od razu lepiej sie prezentuje taki jakis bardziej ludzki:),1,0,0
3185,Putin teraz będzie musiał naprawić linie i żadne granice go nie powstrzymają.,3,6,0
3186,"ojojoj, po prostu pewnie jakby tam swiat bananowych republiczek zaleznych od usa jak ciele od krowy i pod wodza usa nosa nie wsciubil, nie rozlozyl regionu na lopatki a wlasnymi obywatelami po prostu jakos sie opiekowal, to bylby spokoj i porzadek, ale przeciez trzeba prowadzic wojny, ktore trwaja ponad Dekade, rujnowac coraz wiecej i sa owoce.",0,1,0
3187,Arsenał z bronią powinien być dostępny w każdym mieście w Polsce i każdy dorosły obywatel powinien mieć możliwość wziąć broń z arsenału i walczyć w obronie. Na co dzień oczywiście nie. Gdyby na zewnątrz wiedzieli że każdy obywatel ma broń to podchodzili by do nas jak do jeża. Trzeba koniecznie wprowadzić taki system !,0,1,0
3188,"kto uważa, że prezydent jest człowiekeim honoru i się poda do dymisji jak obiecał daje na zielono, któuważa, że nie jest człowiekiem honoru daje na czerwono",2,1,0
3189,prawdziwy Papież by powołał KRUCJATE a nie nawoływał do poddaństwa,4,2,0
3190,"Prześwietlić wszystkich, bo na to czeka naród.",52,24,0
3191,kiedyś podarł pan dokumenty które pewien dziennikarz śledczy panu przyniósł... może się pan do niego zwróci o wyjaśnienie tej sprawy?,73,38,0
3192,"A ja jestem pewien, że to prowokacje mające na celu wzmocnienie argumentów za wprowadzeniem powszechnej inwigilacji internetu. No i czyja ""pewność"" lepsza?",2,0,0
3193,Jaki dziadek taki wnuk.,72,23,0
3194,"Tylko tyle: Art. 129. Zdrada dyplomatyczna
Kto, będąc upoważniony do występowania w imieniu Rzeczypospolitej Polskiej w stosunkach z rządem obcego państwa lub zagraniczną organizacją, działa na szkodę Rzeczypospolitej Polskiej,
podlega karze pozbawienia wolności od roku do lat 10.",51,28,0
3195,Dlatego ma taką władzę,1,0,0
3196,KOD im pomoże.,124,88,0
3197,"tez uwazam ,ze powinnismy pomoc tym najbardziej potzrebujacym.. rola unii jest stworzyc mechanizmy aby nie wpuszczac kazdego kto podejdzie do naszych granic tylko tych ktorzy szukaja schronienia .. sytuacja przypomiona poczatki nienawisci do zydow gdzie caly swiat odwrocil sie od nich a teraz niby strasznie oplakuja ich los w roznego rodzaju rocznicach :/ trzeba byc Czlowiekiem ! i nie pozwalac jesc z glodu trawe dzieciom emigrantow! potzreba madrych rozwiazan a nie powtarzac stereotypy i wszystkich wrzucac do jednego wora!",7,2,0
3198,"Wstydem jest ze przez dwa lata sluzby nie wykryly kto zlecil nagrywanie ministrow,najwiecej krzycza Ci co skorzystali na podsluchach,
moze Archiwum X wykryje,wszyscy wiedza kto skorzystal tylko  
trudno dosc do bossa,czas pokaze .",2,1,0
3199,"W żadnym Państwie UE-nie zmienia się szefów służb-w takim trybie,o tej porze oraz przy zmianie rządu -bo sie zostanie ŚLEPYM.",1,2,0
3200,"i tu widzę miejsce dla Maxa Kolonko.Jest świetny,mówi perfect o angielsku.Jest dobry ma energię.",6,1,0
3201,Kiedy demonstracja KOD-u?,32,17,0
3202,a może pis poda do wiadomości kto podsłuchiwał u sowy? może po chciała to pisowi udowodnić i zawalczyła bronią pisu właśnie. nie widzę tu żadnego zamachu na demokrację a raczej próbę odpłacenia pięknym za nadobne,7,1,0
3203,Ten człowiek uwierzył w to że nie był Bolkiem.,33,17,0
3204,Jak to było z tą teczką  tzw. Bolka? Gdzie są ukradzione z niej dokumenty? Kto miał do niej dostęp? Czyż nie p. Lech Wałęsa?,31,12,0
3205,"@~patriora; Przy moim sutym stole nie ma ani jednego. Ale ja też nie trąbiłem nigdy dokoła, ilu to ich przyjmę...",1,0,0
3206,"Nie znecajcie sie nad człowiekiem ,co wam zrobił?",12,4,0
3207,"Panie Jacku, proszę o taki kanał, ale również w języku:

hiszpańskim, francuskim, niemieckim i chińskim ew. hindu

Obecne platformy cyfrowe umożliwiają taką dywersyfikację. Należy założyć, że nie wszyscy na świecie znają angielski, a chętnie by o Polsce się coś dowiedzieli. 

Pozdrawiam i życzę sukcesów.",1,0,0
3208,a co na to bojownicy KOD ?,82,55,0
3209,Coś w stylu DeutscheWelle - jestem za,1,0,0
3210,"Nie podziwiam Shulza , mam prawo krytykować działania polityczne podejmowane w Niemczech
- niszczenie Polski przez ukryte działania poprzez KE i UE,
- niszczenie Polski przez jawne działania ekonomiczne skierowane przeciw nam - rura z gazem,
- wielowiekowe niszczenie Polski - od początków historii,
- i szereg, szereg innych",317,198,0
3211,"A może w trosce o uczciwe wiadomości dla Polaków wymóc na EuroNew j. polski. Arabski, ruski - czyli główne europejskie języki już są. Polski jest zawieszony...
Nasz głos po angielsku to poza tym dobry pomysł.",1,0,0
3212,"Kurde, to w końcu pan prezydent wyjmie z kieszeni dokumenty, które ponad 20 lat tamu zniknęły z jego teczki! Panie prezydencie, tak trzymać! To się nazywa odwaga - lepiej późno niż wcale.",84,55,0
3213,"Nie było żadnego styropianu , była zmowa europejskich socjalistów socjalistów o podziale łupów.",32,13,0
3214,i wyślą wojsko by Nas okupować,836,124,0
3215,Oddał okładki z teczek?O czym tu debatować?,53,25,0
3216,Może popełnił parę błędów tego nie wiem.   To co zrobił dla Polski i Europy jest bardzo wielkim osiągnięciem. Brakuje nam takich ludzi jak Wałęsa. Mam 72 lata i doskonale pamiętam te czasy. Ta nienawiść do niego wynika z niewiedzy i zazdrości.,8,5,0
3217,"To w najmniejszym stopniu nie uprawnia PiS do działania wbrew prawu ,konstytucji i przyzwoitości.",4,3,0
3218,"Jeszcze nie wymarli. Co wiem,to wiem z tamtych czasów.To był jakiś brat,kuzyn Bolek i była to akcja SB sprokurowana przeciw Wałęsie. Tak trudno doś?. Znajdźcie ludzi,którzy wtedy pracowali w Wydz.Propagandy Kw Gdańsk. To dużo się dowiecie.",1,0,0
3219,listy mogly przyjsc z jasnej gory ;),13,1,0
3220,ja panu wierzę a teraz czas najwyzszy skonczyc z wyzwiskami w internecie To musi byc karalne  Nie moze tak byc zeby polskie chamstwo obrazało wszystkich Obiecała pan takze ze w razie potzreby zmiecie PIs z mapy Polski Juz czas to zrobic Ufam panu i biore go za słowo,3,0,0
3221,to takie polskie: niech u sąsiada zdechną wszystkie krowy,4,1,0
3222,"To taka zabawa, która wciąż trwa...jak wy nas to my was.....jak wy raz to my dwa  razy...",4,0,0
3223,Ja zylam w tych czasach i wiem jak to wygladalo z bliska i szanuje Walese bo malo bylo osob ktore by sie odwazyly na cos takiego,4,1,0
3224,mimo podobnej opinii co do meritum proszę o inny styl wyrażania emocji. Chyba że to prowokacja ?,3,1,0
3225,No i wiemy komu za te problemy możemy podziękować .,51,19,0
3226,"został,tylko na nagraniach nie było nic kompromitującego",5,2,0
3227,Dumna jestem z polakow ze zaglosowali jak zaglosowali!,1523,1061,0
3228,To powinien być priorytet dla prokuratury aby sprawców znaleźć. Trzeba jednak bardzo ostrożnie postępować ponieważ to może być też prowokacja tylko ciekawe przez kogo zrobiona. Bo w grę wchodzi PiS Nowoczesna PO +PSL ale również obcy wywiady które też u nas działają.,2,1,0
3229,"nazwa: ""Who You! = Ty Prezesie""",2,1,0
3230,Dobry kierunek. Ma taki kanał anglojezyczny telewizji satelitarnej np. Ukraina i Rosja.,6,2,0
3231,Byli za słąbi żeby służba bezpieczeństwa się nimi interesowała mole książkowe powiedział jakiś ubek nawet ich nie internowano tatuś miał dobry życiorys chłopcy wychowywali się w PRL na przywillowym ogródku nie bawili się pod trzepakiem na podwórku studni kamienicy przedwojennej.,1,0,0
3232,Głupota opozycji wraz z kodem jest zabawna.,8,10,0
3233,"Na mój rozum, to robota tych co im się Trybunał nie podobał i Sędziowie, a jaka partia chciała obalić obecny Trybunał wszyscy wiemy, że to PIS ubolewał nad składem Trybunału, proste !!!!!",3,0,0
3234,nawet mlodziez wie ze bolek to bolek,32,17,0
3235,"Chociaż głosowałem na PO, to nie jest to jedyny kandydat opozycyjny- Nowoczesna robi postępy i jeżeli nic nie spartolą to będę na nich głosował. Co do podsłuchów, to PiS przekroczy wszelkie normy ale w majestacie prawa, które uchwalą- nie wiem co lepsze?",5,2,0
3236,Jestem  z Panem Panie Prezydencie!,18,3,0
3237,"Co to za artykuł,  PO  nagrywało się na siebie. 
Bezsens.",4,1,0
3238,"Był, nie był. Nie ważne. Bez niego Polska by dzis tak nie wygladała. Duzo zrobił. Duzo dobrego.",4,2,0
3239,widze ze PO dalej jest zdzblem w oku pisowcow haha. PO do roboty kochani nie dajcie sie !!!!!!!!!!!!!,13,0,0
3240,"Art. 127.
Â§ 1. Kto, mając na celu pozbawienie niepodległości, oderwanie części obszaru lub zmianę przemocą konstytucyjnego ustroju Rzeczypospolitej Polskiej, podejmuje w porozumieniu z innymi osobami działalność zmierzającą bezpośrednio do urzeczywistnienia tego celu, podlega karze pozbawienia wolności na czas nie krótszy od lat 10, karze 25 lat pozbawienia wolności albo karze dożywotniego pozbawienia wolności.",52,27,0
3241,Pozdrawiam Panie Prezydencie Wałęsa !!!! jesteśmy zawsze z Panem.,1,0,0
3242,sąd Przyznał rację Wyszkowkiemu i oddalił roszczenia w związku ze zniesławieniem Wałęsy; utrzymuje że Wałęsa ma agenturalną przeszłość;,62,27,0
3243,"Swietnie !!
Sami odcieli się od Krymu - pokazali ze NIE MA tam zadnych ukraincow i tatarow - przecież swoim braciom nie zrobiliby tego !
A wiec po raz kolejny pokazali , ze referendum o powrocie Krymu do Rosji było UCZCIWE !",0,5,0
3244,Jestem za i myślę że Grzegorz Braun jest gotów również nie musi się przygotowywać zgodnie z tym co powiedział Lechu.,43,18,0
3245,super dawno już powinien byc taki kanał!!!,1,0,0
3246,poczekaj podobno Kaczor będzie zwracał z odsetkami,3,1,0
3247,"Podsluchy byly juz wczesniej a PO z nich tylko skorzystala, jak juz byly :-))) Co sie mialy zmarnowac ... :-)",459,163,0
3248,"Ooo, a mieli być nieśmiertelni???
Każdemu grozi smierć",2,1,0
3249,Kaczyński z Ziobrą???,4,0,0
3250,Takiej teczki nigdy nie było.,1,0,0
3251,Bolek jesteśmy z Tobą.,9,2,0
3252,"Niedługo IPN wymysli, ze Piłsudski był agentem",2,0,0
3253,"Pomysł wg mnie niezły, ale Panie Prezesie poproszę o kanał dotyczący edukacji i oświaty w Polsce. Jest o czym rozmawiać, spierać się, układać - wszystko to aby jakość nauczania była coraz wyższa.",2,0,0
3254,"WP widzę, że jeszcze nie zauważyliście że idzie nowe. Onet jednak zauważył to.",0,1,0
3255,"To co w domu slysza,to mowia.Bardzo dobrze,ze P.Walesa postanowil cos z tym zrobic.",4,2,0
3256,To są już jakieś jaja....,390,208,0
3257,"Dla mnie jako Polaka to ta sprawa wygląda tak - Ktoś w nielegalny sposób podsłuchiwał Polskie władze. Następnie przekazał ten nielegalnie zdobyty materiał redaktorom, którzy go opublikowali. Publikacja materiałów skompromitowała nasz rząd na antenie międzynarodowej a gazecie która to opublikowała przyniosła finansowe zyski.
Sprawcy nie można ująć bo dziennikarzy obowiązuje etyka dziennikarska. Wychodzi podsłuchiwanie polityków to najlepszy biznes. Przestępca może podsłuchiwać i jest bezkarny, natomiast policja już nie. 
Największą paranoją jest to że przeciwnicy PO nie widzą w tym nic złego. Co prawda teraz to oni mogą podsłuchiwać już legalnie więc się zabezpieczyli. 
W tym wszystkim nie liczy się dobro Polski czyli Nas wszystkich tylko interes jednej partii. PIS i PO tak podzielą Polskę że niedługo zaczniemy się między sobą tłuc jak tam na bliskim wschodzie.",3,1,0
3258,Ziobro polecił nie szukac :),2,1,0
3259,Czy był czy nie był to dla mnie mało ważne. Jego problem.,3,0,0
3260,Popieram jojo,1,0,0
3261,"Malo kto wie, ze wszystkie informacje wyciagniete od Walesy i przekazane za wynagrodzeniem do UB zanosili bracia Kaczynscy. Ten zbior informacji ubecy nazwali TW Bolek. Kto zna bajke o Bolku i Lolku, ten wie dlaczego taki pseudonim.",2,1,0
3262,BRAWO DZIEWCZYNY - BRAWO !!!!!!!!!!!!!!!!,59,38,0
3263,To jest Polska właśnie zawsze znajdą się ludzie którzy stwierdzą że czarne jest białe a białe jest czarne. Podobnie jest z orkiestrą WOŚP.,6,2,0
3264,zapomniał jak wachowski teczkę mu przywiózł :),44,20,0
3265,CBOS jest to fundacja rządowa badająca opinie wśród społeczeństwa... podkreślam RZĄDOWA a więc nie wiarygodna...PO też zawsze miało dobre sondaże.,2,1,0
3266,"A gdzie CI EXPERCII byli przed zamachem siedzieli Cicho 
poprawnosc polityczna",0,0,0
3267,zaden prorok nie jest kochany w swoim panstwie....WAleso my cibie kochamy i szanujemy zes nas wyswobodzil spod komuny(na Debacie beda cisi   bo komunisci),4,1,0
3268,podkupione  przez  komunistow..ktorych wykiwal  Walesa,1,0,0
3269,Dlatego Trybunał Konstytucyjny jest tak ważny dla PO i ludzi z nimi związanymi a przypominam że to tylko jedna z afer.,126,62,0
3270,A czy dokumenty jakieś sie zachowały?,86,55,0
3271,Pomyliłeś go z JK;),4,1,0
3272,Mamy coraz mądrzejszą młodzież... brawo.,53,25,0
3273,"Dawno powinien Pan to zrobić Panie Prezydencie. Życzę powodzenia, wierzę , ze uda sie Panu.",8,3,0
3274,To jest bardzo ważne - ale tej prawdy nigdy się nie dowiemy.,7,2,0
3275,"Jest napisane "" I PRAWDA WAS WYZWOLI"". ale czy dotyczy to również osoby, które z prawdą minęły się już wiele lat temu.",2217,1499,0
3276,"Gdyby nie Wałęsa,to nie byłoby wolnej Polski.
A poza tym ,mnie za jego czasów żyło się o niebo lepiej niż teraz..",9,3,0
3277,Ciekawe jak pójdą na plaże ? :),0,12,0
3278,Widac ze juz pis przejal media,21,3,0
3279,"WOŚP - SURSUM CORDA - Serca w górę! w Slough pod Londynem. Wielka familiada dla wnuka i dziada jeszcze trwa...Pyszności kulinarne i kuszące ciacha ... Niech nas krzepią niech nas bawią i niejedno serce zbawią. Gratulacje dla pracowitego zespołu Organizatorów i Wolontariuszy. Z takim Sztabem można podbić serce niejednego darczyńcy... z całej plejady usług i sklepów. Niezależnie od opcji i frakcji pomogliśmy wzniosłej akcji, przy sprawnej konferansjerce i aukcji ciepłego duetu. Pokaz sztuki ratowania był imponujący, w fachowej prezentacji p.Konrada Leszczyńskiego. Trzymajmy paluszki za puszki - w roku ubiegłym było 6 tys. funtów a w tym na pewno więcej. JAK TO MIŁO PIEŚCIĆ OCZY KIEDY NARÓD SIE JEDNOCZY",1,0,0
3280,"Walcz Pan o prawdę,prezydencie Wałęsa.",4,0,0
3281,"LULU ja TEZ TEGO NIE OGARNIAM ,ale""OSTATNI BĘDĄ PIERWSZYMI""",1,0,0
3282,"Bardzo dobry pomysł, jeżeli poprowadzi to Max Kolonko to jestem za...",4,1,0
3283,WAŁĘSA GDZIE MOJE STO MILIONÓW?????,63,38,0
3284,Nareszcie mamy Polskę !!!,8,1,0
3285,Tylko .Nowoczesna z Panem Petru ma klasę i jest przyszłością.,5,2,0
3286,Węzełki by sie to potwierdziło to nich sie nie pokazuje w Polsce,108,3,0
3287,"Tą sprawą musi zająć się KOD, a Kijowski musi powołac komisję śledczą.",1042,822,0
3288,To jest temat który powinna poznać cała Polska?,2,1,0
3289,Jak to mowil moj kolega zomowiec  to sie w pale nie mieści  pozdrawiam,85,53,0
3290,"Przecież wolność wywalczył nam pan Jarosław Kaczyński.
To wiedzą  wszyscy.",7,6,0
3291,tak jak pelne teczki ustaw PISU ?,4,2,0
3292,"do wszystkich nas bez problemu dociera, że hitlerowcy ukrywali dobra na Dolnym Śląsku z nadzieją, że tam jeszcze wrócą. Dlaczego więc nie dociera do nas, że UBecja w ostatnim okresie fabrykowała dowody w nadziei, że powróci do władzy?",4,2,0
3293,Kto był Bolkiem to wiemy ... ale pytanie jest kto był Lolkiem. A kto był Tolą?,128,85,0
3294,"Debata powinna toczyć się w oparciu o dokumenty, tylko które, te resztki co zostały w IPN czy też te które Wałęsa âwypożyczył"" sobie za zgodą Milczanowskiego po których podobno ślad zaginął.",73,37,0
3295,bo on jest jednym z nich prawdziwym papiezem byl jan pawelII,1,0,0
3296,czyli polski odpowiednik amerykańskiego CNN czy rosyjskiego RT,1,0,0
3297,"Wywiad w TV? Te oszczerstwa bardziej nadaja sie do sadu.
Ja bym żądał odszkodowania za straty moralne. I zadoscuczynienia.",2,0,0
3298,"Coś mi się zdaje, ze nie wielu będzie miało odwagę stanąć twarzą w twarz z panem Wałęsą nie mając twardych dowodów. To co do tej pory gloszono to tylko tzw.teorie spiskowe, lub jak kto woli domysły,  a to żadne dowody.",13,7,0
3299,Szkoda lubię ja rzeczową i konkretna  dziennikarka.  Pozdrawiam pani Karolino,5,1,0
3300,angela chce szczytu?,51,21,0
3301,Pis nie mówi a działa !!! Dalej tak za ciosem cios !!!,42,19,0
3302,Dlaczego czyścił pan dokumenty z teczki.,52,24,0
3303,"KOD, na ulicę natychmiast. I głośno protestować! Demokracja zagrożona!",623,498,0
3304,A Bolek to taka ładna ksywa.,87,54,0
3305,"Nie trawie pis u ale czekam z niecierpliwością na rozliczenie przez nich wszystkich kolesi z po. Szczególnie s..i bieńkowskiej,  sikorskiego i tuska.",146,140,0
3306,kto to jest Braun?,3,0,0
3307,jak bede mogl ogladac to zaplace.,3,1,0
3308,jak sie potwierdzą koledzy czytać czytać nastepne pomówienie a juz działa,3,0,0
3309,MYŚLI ŻE WSZYSTKIE TECZKI ZNISZCZYŁ.,54,25,0
3310,"Najbardziej mnie zastanawia to powszechne milczenie organizacji feministycznych. Przecież tutaj wszelkie prawa kobiet są nie tyle łamane , co wręcz miażdżone, w świecie muzułmańskim jakiekolwiek prawa kobiet to praktycznie zero w stosunku do tych samych praw w europie i jakoś feministki nie protestują przeciwko masowym migracjom muzułmanów. Liczą na to, że oni wszyscy będą wiecznie mieszkać w obozach pod kontrolą?",82,65,0
3311,"na razie to ortykul o niczym- jak okaze sie prawda to bedzie afera a jak nie, to nie bedzie afery, wiec poco takie oartykuly? Na zamowieni PiS-u? i tak wiadomo ze PiS i PO to jedna rodzina",5,3,0
3312,"Jak to napisał Szułdrzyński to wszystko jasne. Równie przekonująco mógłby napisać, że w Paryskim metrze właśnie ujawnił się poszukiwany od lat YETI. Oddał się w ręce policji i zgodził się wystąpić w reklamie Gillette. Wrzuta jak stodoła. Przez skórę wyczuwam rękę Kurskiego. Kto ma podobnie?
Pozdrawiam czytających",7,3,0
3313,super czlowiek wales jestem z toba,6,1,0
3314,"teraz to trochę za póżno ,trzeba było dawno to zrobić w latach 90tych a nie jak miało sie teczkę u siebie.......",52,24,0
3315,koólek50 - POPIERAM MASZ RACJE !!!!!!!!!!!!!,4,0,0
3316,"Bo to chrzescijanin. A chrzescijanie miluja nawet swoich wrogow. Prawdziwa wartosc naszej religii, a nie udawanie ze jest sie jej czescia. Nie na darmo mowi zeby pomyslec o ""przyczynach"" konfliktu. Przeciez to nie sa glupi ludzie oczywiscie ze sobie zdaja sprawe czemu to sie dzieje, ale musi przez nich przemawiac madrosc od ""Boga"", a nie ulomnosc ludzka.",9,1,0
3317,gdzie akta - czekamy,64,35,0
3318,"Szkoda człowieka, , ktory zatraca sie w swej manii wielkości. Panie Lechu odpuść sobie, tylko zdrowie sie liczy.",65,33,0
3319,Pan Prezydent Wałęsa to człowiek z zaletami i wadami jak każdy z 37 000 000 Polaków dajcie mu już spokój,5,0,0
